11363657-n	biology plants	paul vernier, vernier: French mathematician who described the vernier scale (1580-1637)
11367436-n	plants	publius vergilius maro, vergil, virgil: a Roman poet; author of the epic poem `Aeneid' (70-19 BC)
11401194-n	biology plants	xenophanes: Greek philosopher (560-478 BC)
11486049-n	biology	ion beam, ionic beam: a beam of ions moving in the same direction at the same speed
11492014-n	biology plants	polarisation, polarization: the phenomenon in which waves of light or other radiation are restricted in direction of vibration
11533622-n	biology plants	apothecium: a cuplike ascocarp in many lichens and ascomycetous fungi
11643506-n	biology plants	citronwood, sandarac: durable fragrant wood; used in building (as in the roof of the cathedral at Cordova, Spain)
11654984-n	plants	common sickle pine, falcatifolium falciforme: small tropical rain forest tree of Indonesia and Malaysia
11816829-n	buildings plants	bladder campion, silene uniflora, silene vulgaris: perennial of Arctic Europe having large white flowers with inflated calyx
11896904-n	chemistry food	genus sisymbrium: genus of Old World annual or biennial or perennial herbs with racemose flowers; many are considered to be weeds
11951820-n	buildings plants	chrysopsis mariana, maryland golden aster: perennial golden aster of southeastern United States
11989636-n	biology plants	genus leucanthemum, leucanthemum: comprises plants often included in the genus Chrysanthemum
11999140-n	biology plants	genus othonna: genus of western African herbs or shrubs
12060546-n	plants	eburophyton austinae, phantom orchid, snow orchid: waxy white nearly leafless plant with stems in clusters and racemes of white flowers; northwestern United States to northern California and east to Idaho
12084158-n	biology plants	hooded ladies' tresses, spiranthes romanzoffiana: orchid having dense clusters of gently spiraling creamy white flowers with 2 upper petals forming a hood; western North America
12104238-n	biology plants	tallgrass, tall-grass: any of various grasses that are tall and that flourish with abundant moisture
12144580-n	biology plants	corn: the dried grains or kernels or corn used as animal feed or ground for meal
12161577-n	plants	buttercup squash: plant bearing somewhat drum-shaped fruit having dark green rind with greyish markings
12163456-n	biology plants	bryonia dioica, red bryony, wild hop: bryony having fleshy roots pale green flowers and very small red berries; Europe; North Africa; western Asia
12304572-n	biology plants	flowering ash, fraxinus dipetala: shrubby California ash with showy off-white flowers
12323820-n	biology plants	genus combretum: type genus of the Combretaceae: tropical and subtropical small shrubs and trees
12327528-n	biology plants	anchovy pear, anchovy pear tree, grias cauliflora: West Indian tree bearing edible fruit resembling mango
12351091-n	plants	achira, arrowroot, canna edulis, canna indica, indian shot: canna grown especially for its edible rootstock from which arrowroot starch is obtained
12468719-n	biology plants	dwarf-white trillium, early wake-robin, snow trillium: a low perennial white-flowered trillium found in the southeastern United States
12521186-n	economy	cytisus albus, cytisus multiflorus, white broom, white spanish broom: low European broom having trifoliate leaves and yellowish-white flowers
12531328-n	finance	chanal, chanar, geoffroea decorticans: thorny shrub or small tree common in central Argentina having small orange or yellow flowers followed by edible berries
12580204-n	exchange	genus wisteria: Asiatic deciduous woody vine having large drooping racemes of white or bluish or purple or pinkish flowers and velvety pods; widely grown as an ornamental
12582231-n	administration exchange law	palm, palm tree: any plant of the family Palmae having an unbranched trunk crowned by large pinnate or palmate leaves
12590842-n	insurance	euterpe, genus euterpe: a monocotyledonous genus of graceful palm trees in tropical America
12605315-n	economy	family xyridaceae, xyridaceae, yellow-eyed grass family: plants of tropical to temperate regions; usually in wet places
12613596-n	factotum	genus hydrilla: one species
12623368-n	administration economy	amelanchier, genus amelanchier: North American deciduous trees or shrubs
12667582-n	chemistry	genipa americana, genipap fruit, jagua, marmalade box: tree of the West Indies and northern South America bearing succulent edible orange-sized fruit
12879068-n	metrology	aureolaria virginica, false foxglove, gerardia virginica: sparsely branched North American perennial with terminal racemes of bright yellow flowers resembling those of the foxglove; sometimes placed in genus Gerardia
12883395-n	metrology	genus gerardia: genus of annual or perennial herbs with showy pink or purple or yellow flowers; plants often assigned to genera Aureolaria or Agalinis
12889219-n	factotum	moth mullein, verbascum blattaria: European mullein with smooth leaves and large yellow or purplish flowers; naturalized as a weed in North America
12900462-n	metrology money	capsicum, capsicum pepper plant, pepper: any of various tropical plants of the genus Capsicum bearing peppers
12967124-n	number	genus rosellinia, rosellinia: fungi having smooth perithecia with dark one-celled ascospores
12986337-n	factotum	genus hydnum, hydnum: type genus of Hydnaceae
13031474-n	factotum	jafnea semitosta: the fruiting bodies of this discomycete have a firm texture and long retain their cup shape; the pale brown interior blends with the color of dead leaves
13083461-n	transport	bedder, bedding plant: an ornamental plant suitable for planting in a flowerbed
13086556-n	factotum	field crop: a crop (other than fruits or vegetables) that is grown for agricultural purposes; "cotton, hay, and grain are field crops"
13094273-n	factotum	sorus: a spore-producing structure in certain lichens and fungi
13124019-n	geometry	rupestral plant, rupestrine plant, rupicolous plant, saxicolous plant: plants growing among rocks
13130014-n	factotum	cladode, cladophyll, phylloclad, phylloclade: a flattened stem resembling and functioning as a leaf
13158815-n	sociology	oblanceolate leaf: a leaf having a rounded apex and tapering base
13215063-n	animals	genus marattia, marattia: type genus of the Marattiaceae: ferns having the sporangia fused together in two rows
13222985-n	physiology	alpine clubmoss, lycopodium alpinum: a variety of club moss
13273836-n	medicine	dividend: a bonus; something extra (especially a share of a surplus)
13325010-n	medicine	charge per unit, rate: amount of a charge or payment relative to some basis; "a 10-minute phone call at that rate would cost $5"
13325505-n	medicine	surcharge: an additional charge (as for items previously omitted or as a penalty for failure to exercise common caution or common skill)
13326198-n	medicine	freight, freightage, freight rate: the charge for transporting something by common carrier; "we pay the freight"; "the freight rate is usually cheaper"
13334307-n	medicine	stockholding: ownership of stocks; the state or fact of holding stock; "prohibition of unrestricted intercorporate stockholding"- W.Z.Ripley
13438671-n	medicine	biochemical mechanism: a chemical mechanism involved in vital processes occurring in living organisms
13496017-n	medicine	imbibition: (chemistry) the absorption of a liquid by a solid or gel
13502205-n	medicine	inversion: a chemical process in which the direction of optical rotation of a substance is reversed from dextrorotatory to levorotary or vice versa
13504947-n	medicine	karyolysis: disintegration and dissolution of a cell nucleus when a cell dies
13542474-n	medicine	prophase: the first stage of meiosis
13543564-n	medicine	psychosexual development: (psychoanalysis) the process during which personality and sexual behavior mature through a series of stages: first oral stage and then anal stage and then phallic stage and then latency stage and finally genital stage
13570472-n	psychiatry	tripling: increase by a factor of three
13620871-n	sociology	bushel: a United States dry measure equal to 4 pecks or 2152.42 cubic inches
13666790-n	finance	bolivar: the basic unit of money in Venezuela; equal to 100 centimos
13691764-n	town_planning	colombian peso, peso: the basic unit of money in Colombia; equal to 100 centavos
13692559-n	factotum	guinea-bissau peso, peso: the basic unit of money in Guinea-Bissau; equal to 100 centavos
13699313-n	factotum	armenian monetary unit: monetary unit in Armenia
13702396-n	money tax	tajikistani monetary unit: monetary unit in Tajikistan
13706993-n	factotum	tanzanian monetary unit: monetary unit in Tanzania
13770635-n	chemistry	teacup, teacupful: as much as a teacup will hold
13777211-n	chemistry	small fortune: a large sum of money; "he made a small fortune in the commodities market"
13823287-n	geology	fuel consumption rate, gas mileage, gasoline mileage, mileage: the ratio of the number of miles traveled to the number of gallons of gasoline burned
13846199-n	chemistry	first, number one: the first or highest in an ordering or series; "He wanted to be the first"
13880704-n	biology chemistry color	scalene triangle: a triangle with no two sides of equal length
13900914-n	chemistry	columella: a small column (or structure resembling a column) that is a part of a plant or animal
13920835-n	animals	condition, status: a state at a particular time; "a condition (or state) of disrepair"; "the current status of the arms negotiations"
13943400-n	chemistry	case, event: a special set of circumstances; "in that event, the first possibility is excluded"; "it may rain in which case the picnic will be canceled"
13947867-n	chemistry	place: proper or appropriate position or location; "a woman's place is no longer in the kitchen"
14048441-n	chemistry	childbed, confinement, labor, labour, lying-in, parturiency, travail: concluding state of pregnancy; from the onset of contractions to the birth of a child; "she was in labor for six hours"
14084709-n	geology	alcaptonuria, alkaptonuria: a rare recessive metabolic anomaly marked by ochronosis and the presence of alkapton in the urine
14095273-n	military physics	flaccid paralysis: weakness or loss of muscle tone resulting from injury or disease of the nerves innervating the muscles
14106609-n	military physics	aortic stenosis: abnormal narrowing of the aortic valve
14110219-n	chemistry military physics	bacteremia, bacteriaemia, bacteriemia: transient presence of bacteria (or other microorganisms) in the blood
14173823-n	chemistry	peritonsillar abscess, quinsy: a painful pus filled inflammation of the tonsils and surrounding tissues; usually a complication of tonsillitis
14233267-n	geology	xanthoma: a skin problem marked by the development (on the eyelids and neck and back) of irregular yellow nodules; sometimes attributable to disturbances of cholesterol metabolism
14237032-n	biology chemistry gastronomy	glioma: a tumor of the brain consisting of neuroglia
14324274-n	religion	agony, excruciation, suffering: a state of acute pain
14333863-n	religion	papule: a small inflamed elevation of skin that is nonsuppurative (as in chicken pox)
14343411-n	time_period	cerebromeningitis, encephalomeningitis, meningoencephalitis: inflammation of the brain and spinal cord and their meninges
14415518-n	metrology transport	detachment, insularism, insularity, insulation: the state of being isolated or detached; "the insulation of England was preserved by the English Channel"
14427065-n	time_period	childhood, puerility: the state of a child between infancy and adolescence
