04166111-n	factotum	security system: (computing) a system that enforces boundaries between computer networks
04171373-n	music	semi-abstraction: a semiabstract painting
04226962-n	transport	skep: a domed beehive made of twisted straw
04255163-n	factotum	socket: receptacle where something (a pipe or probe or end of a bone) is inserted
04261281-n	buildings	souk: an open-air market in an Arabian city
04270765-n	home	speaking tube: a tube for conveying the sound of a voice from one room to another
04282379-n	nautical	spline: a flexible strip (wood or rubber) used in drawing curved lines
04329190-n	military	depot, entrepot, storage, store, storehouse: a depository for goods; "storehouses were built close to the docks"
04435180-n	furniture	tile: a flat thin rectangular slab (as of fired clay or rubber or linoleum) used to cover surfaces
04493259-n	factotum	t-square: a square used by draftsmen to draw parallel lines
04526964-n	factotum	ventilator: a device (such as a fan) that introduces fresh air or expels foul air
04560619-n	buildings	water jacket: a container filled with water that surrounds a machine to cool it; especially that surrounding the cylinder block of an engine
04590129-n	factotum	window shade: an opaque window blind that can cover or uncover a window
04613350-n	factotum	yoke: support consisting of a wooden frame across the shoulders that enables a person to carry buckets hanging from each end
04684654-n	biology	exquisiteness: extreme beauty of a delicate sort
04687333-n	chemistry	appeal, appealingness, charm: attractiveness that interests or pleases or stimulates; "his smile was part of his appeal to her"
04729984-n	music	loftiness, majesty, stateliness: impressiveness in scale or proportion
04737743-n	factotum	progressiveness, progressivity: advancement toward better conditions or policies or methods
04780396-n	factotum	unpalatability, unpalatableness: the property of being unacceptable to the mind; "the policy's unpalatability caused an uproar"
04788159-n	factotum	coyness, demureness: the affectation of being demure in a provocative way
04848866-n	factotum	religiousness: the quality of being extremely conscientious; "his care in observing the rules of good health amounted to a kind of religiousness"
04849074-n	factotum	unconscientiousness: the quality of being willing to ignore the dictates of conscience
04909721-n	factotum	prankishness, rascality, roguishness: the trait of indulging in disreputable pranks
04935003-n	anatomy	viscosity, viscousness: resistance of a liquid to shear forces (and hence to flow)
04960729-n	anatomy	white, whiteness: the quality or state of the achromatic color of greatest lightness (bearing the least resemblance to black)
04961691-n	medicine	gray, grayness, grey, greyness: a neutral achromatic color midway between white and black
04987620-n	anatomy	quality, timber, timbre, tone: (music) the distinctive property of a complex sound (a voice or noise or musical sound); "the timbre of her soprano was rich and lovely"; "the muffled tones of the broken bell summoned them to meet"
05020225-n	anatomy	magnetisation, magnetization: the physical property of being magnetic
05047059-n	anatomy	lateness: quality of coming late or later in time
05127640-n	biology	latitude: scope for freedom of e.g. action or thought; freedom from restriction
05185444-n	anatomy	right to an attorney: a civil right guaranteed by the 6th amendment to the US Constitution
05229805-n	anatomy	germ: a small apparently simple structure (as a fertilized egg) from which new tissue can develop into a complete organism
05236582-n	anatomy	aortic plexus: a plexus of lymph nodes in the lower portion of the abdominal aorta
05264545-n	anatomy	fundus: (anatomy) the base of a hollow organ or that part of the organ farthest from its opening; "the uterine fundus"; "the fundus of the stomach"
05273555-n	anatomy person	cartilage bone: any bone that develops within cartilage rather than a fibrous tissue
05296127-n	factotum	perimysium: the sheath of connective tissue that covers a bundle of muscle fibers
05313344-n	art	ciliary body: the part of the tunic of the eye between the choroid coat and the iris; "the ciliary body produces aqueous humor"
05319760-n	religion	intima: the innermost membrane of an organ (especially the inner lining of an artery or vein or lymphatic vessel)
05346406-n	psychology	arteria glutes, gluteal artery: branches of the internal iliac artery that supply the hip joint and gluteal region
05386139-n	food	haversian canal: any of the many tiny canals that contain blood vessels and connective tissue and that form a network in bone
05387842-n	acoustics	alveolar bed: lung tissue densely packed with alveoli
05469664-n	factotum	proprioceptor: special nerve endings in the muscles and tendons and other organs that respond to stimuli regarding the position and movement of the body
05507427-n	factotum	lumbosacral plexus: a nerve plexus formed by the ventral divisions of the coccygeal and sacral and lumbar nerves; supplies the lower limbs and perineum and coccygeal area
05513807-n	factotum	male reproductive system: the reproductive system of males
05524062-n	mathematics	cervical glands, cervical glands of the uterus, glandulae cervicales uteri: mucus-secreting glands in the mucosa of the uterine cervix
05600431-n	religion	naris: any of the openings to the nasal cavities that allow air to flow through the cavities to the pharynx
05643722-n	economy	housecraft: skill in domestic management
05668915-n	mathematics	protocol: code of correct conduct; "safety protocols"; "academic protocol"
05677504-n	mathematics	sense: a general conscious awareness; "a sense of security"; "a sense of happiness"; "a sense of danger"; "a sense of self"
05804136-n	acoustics	guesstimate, guestimate: an estimate that combines reasoning with guessing
05842706-n	politics	romanesque, romanesque architecture: a style of architecture developed in Italy and western Europe between the Roman and the Gothic styles after 1000 AD; characterized by round arches and vaults and by the substitution of piers for columns and profuse ornament and arcades
05856217-n	religion	zero, zero point: the point on a scale from which positive or negative numerical quantities can be measured
05866489-n	factotum	chaotic attractor, strange attractor: an attractor for which the approach to its final point in phase space is chaotic
05897553-n	computer_science	apparition, fantasm, phantasm, phantasma, phantom, shadow: something existing in perception only; "a ghostly apparition at midnight"
05984066-n	literature	point: the object of an activity; "what is the point of discussing it?"
05987835-n	literature	edification, sophistication: uplifting enlightenment
06010737-n	literature	space-time, space-time continuum: the four-dimensional coordinate system (3 dimensions of space and 1 of time) in which physical events are located
06063072-n	religion	serology: the branch of medical science that deals with serums; especially with blood serums and disease
06169667-n	computer_science	comparative literature: study of literary works from different cultures (often in translation)
06169806-n	computer_science	lit crit, literary criticism: the informed analysis and evaluation of literature
06171265-n	computer_science	dialectology: the branch of philology that is devoted to the study of dialects
06267655-n	graphic_arts	gazette: a newspaper or official journal
06341862-n	factotum	senor: a Spanish title or form of address for a man; similar to the English `Mr' or `sir'
06347122-n	factotum	mistranslation: an incorrect translation
06413260-n	factotum	pop-up, pop-up book: a book (usually for children) that contains one or more pages such that a three-dimensional structure rises up when a page is opened
06420219-n	linguistics	unabridged, unabridged dictionary: a dictionary that has not been shortened by the omitting terms or definitions; a comprehensive dictionary
06423378-n	linguistics	itinerary, travel guidebook: a guidebook for travelers
06500765-n	linguistics	finger alphabet, manual alphabet: an alphabet used by the deaf; letters are represented by finger positions
06523641-n	linguistics	insurance, insurance policy, policy: written contract or certificate of insurance; "you should have read the small print on your policy"
06537323-n	linguistics	bill of attainder: a legislative act finding a person guilty of treason or felony without a trial; "bills of attainder are prohibited by the Constitution of the United States"
06596364-n	linguistics music	comic book: a magazine devoted to comic strips
06618549-n	music	jump cut: an immediate transition from one scene to another
06664594-n	literature	canon: a rule or especially body of rules or principles generally established as valid and fundamental in a field or art or philosophy; "the neoclassical canon"; "canons of polite society"
06701596-n	factotum	master of education, med: a master's degree in education
06728726-n	factotum	fourteenth amendment: an amendment to the Constitution of the United States adopted in 1868; extends the guarantees of the Bill of Rights to the states as well as to the federal government
06802258-n	factotum	hairline: a very thin line
06816445-n	factotum	choreography: a notation used by choreographers
06831712-n	music	f: the 6th letter of the Roman alphabet
06832356-n	linguistics	l: the 12th letter of the Roman alphabet
06857591-n	factotum	roulade: (music) an elaborate run of several notes sung to one syllable
06872562-n	factotum	baritone, baritone voice: the second lowest adult male singing voice
06888944-n	factotum	sight: anything that is seen; "he was a familiar sight on the television"; "they went to Paris to see the sights"
06898052-n	factotum	solresol: an artificial language
06972558-n	factotum	shina: a Dardic language spoken in northern Kashmir
06979853-n	factotum	badaga: the dialect of Kannada that is spoken by the Badaga
06994700-n	free_time sociology	xhosa: a Bantu language closely related to Zulu
07031401-n	psychological_features sexuality	secondo: the second or lower part of a duet (especially a piano duet)
07035153-n	psychological_features sexuality	gregorian chant, plainchant, plainsong: a liturgical chant of the Roman Catholic Church
07035305-n	psychological_features	cantus firmus: a melody used as the basis for a polyphonic composition
07053732-n	psychological_features	serenade: a song characteristically played outside the house of a woman
07099844-n	gastronomy	epanodos: repetition of a group of words in reverse order
07126228-n	chemistry gastronomy	expletive: a word or phrase conveying no independent meaning but added to fill out a sentence or metrical line
07206887-n	chemistry gastronomy	contradiction, contradiction in terms: (logic) a statement that is necessarily false; "the statement `he is brave and he is not brave' is a contradiction"
07276242-n	chemistry gastronomy plants	system command: a computer user's instruction (not part of a program) that calls for action by the computer's executive program
07286278-n	chemistry gastronomy plants	war cloud: an ominous sign that war threatens
07294699-n	chemistry gastronomy plants	sequella: a secondary consequence
07341038-n	gastronomy	cycle, oscillation: a single complete execution of a periodically repeated phenomenon; "a year constitutes a cycle of the seasons"
07341665-n	food plants	carnot cycle, carnot's ideal cycle: a cycle (of expansion and compression) of an idealized reversible heat engine that does work without loss of heat
07343574-n	gastronomy	atavism, reversion, throwback: a reappearance of an earlier characteristic
07397355-n	gastronomy	thunder: a booming or crashing noise caused by air expanding along the path of a bolt of lightning
07420217-n	chemistry food	resolution: the subsidence of swelling or other signs of inflammation (especially in a lung)
07474809-n	factotum	grand slam: winning all of the tricks in a hand of bridge
07524529-n	food	care, concern, fear: an anxious feeling; "care had aged him"; "they hushed it up out of fear of public reaction"
07573103-n	enterprise publishing	canned meat, tinned meat: meat preserved in a can or tin
07585758-n	enterprise	gazpacho: a soup made with chopped tomatoes and onions and cucumbers and peppers and herbs; served cold
07586718-n	sport	pepper pot, philadelphia pepper pot: a soup made with vegetables and tripe and seasoned with peppercorns; often contains dumplings
07605198-n	religion	dragee: sugar-coated nut or fruit piece
07617344-n	biology	flummery: a bland custard or pudding especially of oatmeal
07641380-n	administration pedagogy politics	german pancake, pfannkuchen: puffy mildly sweet lemon-flavored egg mixture sprinkled with confectioners' sugar and served with jam or a wine or fruit sauce
07659425-n	religion	pin bone: part of the sirloin between the flat bone and the porterhouse
07754894-n	factotum	cacao bean, cocoa bean: seed of the cacao tree; ground roasted beans are source of chocolate
07760297-n	history politics	ribier: dark reddish-purple table grape of California
07812184-n	factotum	spice: any of a variety of pungent aromatic vegetable substances used for flavoring food
07826091-n	law	tabasco, tabasco sauce: very spicy sauce (trade name Tabasco) made from fully-aged red peppers
07848338-n	enterprise tourism	butter: an edible emulsion of fat globules made by churning milk or cream; for cooking and table use
07857076-n	economy	garlic butter: butter seasoned with mashed garlic
07878785-n	heraldry sociology	hot stuffed tomato, stuffed tomato: tomato cases filled with various mixtures and baked briefly
07942152-n	law	people: (plural) any group of human beings (men or women or children) collectively; "old people"; "there were at least 200 people in the audience"
07976069-n	geography	carload: a gathering of passengers sufficient to fill an automobile
08168978-n	geography	body politic, commonwealth, country, land, nation, res publica, state: a politically organized body of people under a single government; "the state has elected a new president"; "African nations"; "students who had come to the nation's capitol"; "the country's largest manufacturer"; "an industrialized land"
08289089-n	geography	youth culture: young adults (a generational unit) considered as a cultural class or subculture
08311282-n	geography	city council: a municipal body that can pass ordinances and appropriate funds etc.
08375526-n	geography	lobby, pressure group, third house: a group of people who try actively to influence legislation
08388074-n	geography	few: a small elite group; "it was designed for the discriminating few"
08390374-n	geography	paratroops: infantry trained and equipped to parachute
08408115-n	geography	peepshow, raree-show: an exhibition of pictures or objects viewed through a small hole or magnifying glass
08486075-n	geography	william and mary: joint monarchs of England; William III and Mary II
08501275-n	geography	heliopause: the boundary marking the edge of the sun's influence; the boundary (roughly 100 AU from the sun) between the interplanetary medium and the interstellar medium; where the solar wind from the sun and the radiation from other stars meet
08511241-n	geography	bottom, underside, undersurface: the lower side of anything
08514865-n	administration geography nautical	fence line: a boundary line created by a fence
08541609-n	geography	commune: the smallest administrative district of several European countries
08550862-n	geography	archdiocese: the diocese of an archbishop
08602822-n	geography geology	big bend national park: a large national park in Texas featuring mountains and desert and canyons and wildlife
08719892-n	geography geology	eelam, tamil eelam: the independent state that the Tamil Tigers have fought for
08722844-n	geography geology	manchuria: a region in northeastern China
08724726-n	factotum	beijing, capital of red china, peiping, peking: capital of the People's Republic of China in the Hebei province in northeastern China; 2nd largest Chinese city
08839714-n	factotum	kwajalein: an atoll in the western Marshall Islands that was used as a Japanese air and naval base during World War II
08929722-n	mythology	gallia, gaul: an ancient region of western Europe that included what is now northern Italy and France and Belgium and part of Germany and the Netherlands
08935848-n	person	dijon: an industrial city in eastern France to the north of Lyons
08950035-n	mythology	apeldoorn: a city of east central Netherlands; a popular tourist center and site of the summer residence of the Dutch royal family
08952190-n	mythology	hungary, magyarorszag, republic of hungary: a republic in central Europe
08970445-n	mythology	capital of morocco, rabat: the capital of Morocco; located in the northwestern on the Atlantic coast
08982587-n	factotum	poland, polska, republic of poland: a republic in central Europe; the invasion of Poland by Germany in 1939 started World War II
08992067-n	mythology pedagogy	pago pago, pango pango: a port in American Samoa
08999154-n	literature	horn of africa, somali peninsula: a peninsula of northeastern Africa (the easternmost part of Africa) comprising Somalia and Djibouti and Eritrea and parts of Ethiopia
09031653-n	anthropology	schweiz, suisse, svizzera, swiss confederation, switzerland: a landlocked federal republic in central Europe
09084196-n	geography	rockford: a city in northern Illinois
09108884-n	anthropology geography	butte: a town in southwestern Montana; center for mining copper
09180616-n	person	abience: (psychology) an urge to withdraw or avoid a situation or an object
09216442-n	military	bay of bengal: an arm of the Indian Ocean to the east of India
09227428-n	biology	bottom, bottomland: low-lying alluvial land near a river
09265620-n	music	declension, declination, decline, declivity, descent, downslope, fall: a downward slope or bend
09327201-n	aviation nautical	korea bay: an inlet of the Yellow Sea between the Liaodong Peninsula in China and western Korea
09352108-n	administration law	mesabi range: a range of hills in northeastern Minnesota where rich iron ore deposits were discovered in 1887
09391996-n	person	pike's peak: a mountain peak in the Rockies in central Colorado (14,109 feet high)
09433721-n	factotum	shore boulder: a boulder found on a shore remote from its place of origin
09495732-n	person	euphrosyne: (Greek mythology) one of the three Graces
09533668-n	buildings	heavenly jewel, tien-pao: a member of the Taoist Trinity
09537781-n	humanities	holy ghost, holy spirit, paraclete: the third person in the Trinity; Jesus promised the Apostles that he would send the Holy Spirit after his Crucifixion and Resurrection; it came on Pentecost
09600901-n	football	kilroy: a nonexistent person popularized by American servicemen during World War II; "Kilroy was here"
09625309-n	economy	naprapath: a therapist who practices naprapathy
09637211-n	factotum	black man: a man who is Black
09655018-n	banking money	erie: a member of an Iroquoian people formerly living on the south shore of Lake Erie in northern Ohio and northwest Pennsylvania and western New York
09665897-n	anthropology	pima: a member of the North American Indian people living in southern Arizona and northern Mexico
09711435-n	factotum	laconian: a resident of Laconia
09714694-n	person	iraki, iraqi: a native or inhabitant of Iraq; "the majority of Iraqi are Arab Shiite Muslims although Sunni Muslims control the government"
09722399-n	photography	mauritanian: a native or inhabitant of Mauritania
09832873-n	baseball play	bahai: a teacher of or believer in Bahaism
09840871-n	administration person	barrater, barrator: someone guilty of barratry
09848916-n	literature	bell captain: the supervisor of bellboys in a hotel
09863339-n	literature	boffin: (British slang) a scientist or technician engaged in military research
09901337-n	commerce	catechist: one who instructs catechumens in preparation for baptism (especially one using a catechism)
09934213-n	person	co-ed, college girl: a female student at a coeducational college or university
09950457-n	person	compulsive: a person with a compulsive disposition; someone who feels compelled to do certain things
09960001-n	factotum	consumptive, lunger, tubercular: a person with pulmonary tuberculosis
09965625-n	law	corespondent, co-respondent: the codefendant charged with adultery with the estranged spouse in a divorce proceeding
09967555-n	person	cossack: a member of a Slavic people living in southern European Russia and Ukraine and adjacent parts of Asia and noted for their horsemanship and military skill; they formed an elite cavalry corps in czarist Russia
10009276-n	geography history	detective, investigator, police detective, tec: a police officer who investigates crimes
10026763-n	religion	doorkeeper, ostiarius, ostiary: the lowest of the minor Holy Orders in the unreformed Western Church but now suppressed by the Roman Catholic Church
10034785-n	history	driveller, jabberer: someone whose talk is trivial drivel
10069645-n	military	executive, executive director: a person responsible for the administration of a business
10081842-n	factotum	father-figure: a man (often a powerful or influential man) who arouses emotions usually felt for your real father and with whom you identify psychologically
10118587-n	literature	galvaniser, galvanizer: a skilled worker who coats iron or steel with zinc
10142946-n	chemistry	grandmaster: a player of exceptional or world class skill in chess or bridge
10188226-n	person religion	cat burglar, housebreaker: a burglar who unlawfully breaks into and enters another person's house
10189179-n	painting	house painter: a painter of houses a similar buildings
10241024-n	physics	birthing coach, doula, labor coach, monitrice: an assistant (often the father of the soon-to-be-born child) who provides support for a woman in labor by encouraging her to use techniques learned in childbirth-preparation classes
10327143-n	history person	molecular biologist: a biologist who studies the structure and activity of macromolecules essential to life
10352208-n	history religion	negotiatress, negotiatrix: a woman negotiator
10363360-n	history religion	noticer: someone who gives formal notice
10441694-n	physics	pledger: someone who makes or gives a pledge
10453265-n	architecture painting	poor devil, wretch: someone you feel sorry for
10462429-n	history person	ball of fire, fireball, human dynamo, powerhouse: a highly energetic and indefatigable person
10465922-n	anthropology	presbyterian: a follower of Calvinism as taught in the Presbyterian Church
10468962-n	music	chair, chairman, chairperson, chairwoman, president: the officer who presides at the meetings of an organization; "address your remarks to the chairperson"
10505347-n	heraldry	rainmaker: American Indian medicine man who attempt to make it rain
10518602-n	religion school	religious: a member of a religious order who is bound by vows of poverty and chastity and obedience
10574425-n	history military politics	section man: someone who teaches a section of a large college course
10574723-n	medicine	gravida ii, secundigravida: a woman who is pregnant for the second time
10586557-n	architecture	shark: a person who is unusually skilled in certain ways; "a card shark"
10587227-n	politics	shearer: a workman who uses shears to cut leather or metal or textiles
10593618-n	art	shoveler, shoveller: a worker who shovels; "a shoveler of coal"
10594147-n	literature	shrew, termagant: a scolding nagging bad-tempered woman
10608073-n	animals biology	skycap: a porter who helps passengers with their baggage at an airport
10639238-n	music theatre	sport, summercater: (Maine colloquial) a temporary summer resident of Maine
10640327-n	literature	spotter: a worker employed at a dry-cleaning establishment to remove spots
10646032-n	literature	stainer: a worker who stains (wood or fabric)
10772289-n	electricity	webmaster: a technician who designs or maintains a website
10855834-n	biology plants	boltzmann, ludwig boltzmann: Austrian physicist who contributed to the kinetic theory of gases (1844-1906)
10864428-n	buildings plants	brinton, daniel garrison brinton: United States anthropologist who was the first to attempt a systematic classification of Native American languages (1837-1899)
10891428-n	biology plants	cattell, james mckeen cattell: American psychologist and editor (1860-1944)
10991415-n	biology plants	david garrick, garrick: English actor and theater manager who was the foremost Shakespearean actor of his day (1717-1779)
11021667-n	plants	ernst heinrich haeckel, haeckel: German biologist and philosopher; advocated Darwinism and formulated the theory of recapitulation; was an exponent of materialistic monism (1834-1919)
11027416-n	biology plants	hancock, john hancock: American revolutionary patriot who was president of the Continental Congress; was the first signer of the Declaration of Independence (1737-1793)
11052186-n	biology plants	harold hirschsprung, hirschsprung: Danish pediatrician (1830-1916)
11112377-n	biology plants	kubrick, stanley kubrick: United States filmmaker (born in 1928)
11112488-n	biology plants	kuhn, richard kuhn: Austrian chemist who did research on carotenoids and vitamins (1900-1967)
11141981-n	biology plants	lovell, sir alfred charles bernard lovell, sir bernard lovell: English astronomer who pioneered radio astronomy (born in 1913)
11248232-n	biology plants	augustus welby northmore pugin, pugin: English architect who played a prominent role in the 19th century revival of Gothic architecture (1812-1852)
11251788-n	biology plants	jean baptiste racine, jean racine, racine: French advocate of Jansenism; tragedian who based his works on Greek and Roman themes (1639-1699)
11281837-n	biology plants	john singer sargent, sargent: United States painter (born in Italy) known for his society portraits (1856-1925)
11345017-n	plants	alice b. toklas, toklas: United States writer remembered as the secretary and companion of Gertrude Stein (1877-1967)
